<?xml version="1.0" encoding="UTF-8"?>
<settings
	xsi:schemaLocation="http://www.tvd12.com/schema/ezyfox/settings
  		ezy-settings-1.0.0.xsd"
	xmlns="http://www.tvd12.com/schema/ezyfox/settings" 
	xmlns:xsi="http://www.w3.org/2001/XMLSchema-instance">
	
	<http>
		<port>8080</port>
	</http>
	
	<socket>
		<port>3005</port>
		<codec-creator>com.tvd12.ezyfoxserver.codec.MsgPackCodecCreator</codec-creator>
	</socket>
	
	<web-socket>
		<port>2208</port>
		<ssl-port>2812</ssl-port>
		<ssl-active>false</ssl-active>
		<ssl-config>
			<file>ssl-config.properties</file>
			<loader>com.tvd12.ezyfoxserver.ssl.EzySimpleSslConfigLoader</loader>
			<context-factory-builder>com.tvd12.ezyfoxserver.ssl.EzySimpleSslContextFactoryBuilder</context-factory-builder>
		</ssl-config>
		<codec-creator>com.tvd12.ezyfoxserver.codec.JacksonWsCodecCreator</codec-creator>
	</web-socket>
	
	<user-management>
		<user-max-idle-time>15000</user-max-idle-time>
		<max-session-per-user>15</max-session-per-user>
	</user-management>
	
	<session-management>
		<session-max-idle-time>15000</session-max-idle-time>
		<session-max-waiting-time>30000</session-max-waiting-time>
	</session-management>
	
	<applications>
		<application>
			<name>ezyfox-chat</name>
			<entry-loader>com.tvd12.ezyfoxserver.chat.EzyChatEntryLoader</entry-loader>
			<worker-thread-pool-size>30</worker-thread-pool-size>
		</application>
	</applications>
	
	<plugins>
		<plugin>
			<name>ezyfox-auth-plugin</name>
			<priority>-1</priority>
			<entry-loader>com.tvd12.ezyfoxserver.plugin.auth.EzyAuthPluginEntryLoader</entry-loader>
			<worker-thread-pool-size>30</worker-thread-pool-size>
		</plugin>
	</plugins>
</settings>

<!-- http://localhost:8080/schema/ezyfox/settings/ -->